Username,Rating,Date,Opinion
Marianek,9,2018-12-05 17:01:02,"Oko: barwa brązowo-czarna, piana ciemnobrązowa, niska, niezbyt trwała, zostawia bardzo gęsty wręcz oleisty ślad na szkle.<br>Nos: solidna kombinacja słodów palonych, do tego wanilia, kokos i lekko sos sojowy, dębina, przyjemna nuta alkoholowa, zapowiada się słodko, likierowo.<br>Smak: gęste, kremowe na języku, niskie wysycenie. Solidna porcja słodyczy słodowej (likier, pralinki), palone nuty, wanilia, karmel, kokos, momentami marcepan, nieco suszonych owoców,  wyczuwalna nuta alkoholowa, ale przyjemna kojarząca się z dobrym alkoholem. Finisz krótki, słodycz przebijająca się przez palone akcenty i orzechowy posmak. Goryczka palona średnia w kierunku niskiej. Alkohol wyczuwalny, ale przyjemny w smaku i poprzez grzanie w przełyk.<br>Kilka miesięcy leżakowania troszkę ułożyło alkohol, aromat nadal wyraźny stanowi najmocniejszy punkt tego trunku, a smak nieco mu ustępuje. Ogólnie dobry RIS.<div style='text-align:right;'><img src='pliki/oceny.png' alt='oceny' style='vertic"
Brodzisław,9,2018-04-24 21:31:37,"Kolor czarny, nieprzenikniony, piana beżowa z drobniutkich pęcherzyków, opadła do krążka na powierzchni. <br>Aromat z butelki beczki, nuty szlachetnych alkoholi: bourbon/rum, dalej czekolada i likier czekoladowy. W szkle intensywnie i gęsto. Czekolada i likier kawowy a zaraz za tym nuty drewna i bourbon/rum. Jest też trochę karmelu, trufli, kokosu i wanilii ale też i alkoholu. <br>W smaku bardzo gęste, oleiste. Ponownie czekolada z nutą kawy aż po kakao. Wanilia i samo drewno z dodatkiem alkoholowych nut bourbona i rumu. Z czasem piwo staje się bardziej wytrawne, alkohol wyczuwalny poprzez lekkie szczypanie w jamie gębowej i rozgrzewanie. Goryczka niezbyt intensywna, palona i alkoholowa głównie. Wysycenie pomiędzy niskim a średnim. <br>Potężny, całkiem pijalny RIS. Genialny aromat, w smaku drażni jednak nuta alkoholowa. <br><div style='text-align:right;'><img src='pliki/oceny.png' alt='oceny' style='vertic"
Bob,8,2018-04-07 22:45:51,"Bardzo, bardzo mocny alkohol w zapachu jak i smaku. Jest to główna i chyba jedyna wada tego piwa. Ogółem to zapach (pomijając alko) jest niesamowity, na początku mocno rumowy (trzcinowy?), potem przechodzący w bounty. Burbon wyczuwalny, choć beczka po rumie dominuje. W smaku alkohol wszystko przykrywa, piwo mimo swojej wyjątkowości piję się wybitnie źle. Ciała mniej czuć niż w ""podstawce"", aromatów jest multum: Kawa, przyjemna wanilia, lekki kokos, czekolada, trochę karmelu, śladowe ciemne owoce. Czekolada szczególnie wyczuwalna jakiś czas po przełknięciu, szkoda że mało ją czuć wcześniej. Raczej rozczarowanie, spodziewałem się waniliowo-czekoladowego mocarnego ulepa. A dostałem alkoholowo wytrawną ciężka ""bestię"", nie moje klimaty.<div style='text-align:right;'><img src='pliki/oceny.png' alt='oceny' style='vertic"
prisoner,9,2018-10-24 23:03:23,"Aromat faktycznie kpie kubki smakowe, dużo świeżej ziarnistej kawy, czekolada, laktoza, wanilia i trochę później kawa z mleczkiem. Smak słodkawy, kawka z mlekiem, ciasto orzechowe, finisz już kakaowy, lekko palony z nutami gałki muszkatołowej (lekkie szczypanie). Bardzo dobre, szkoda, że takie małe...<div style='text-align:right;'><img src='pliki/oceny.png' alt='oceny' style='vertic"
Marianek,9,2018-07-31 21:18:15,"Oko: czerń. Piana ciemny beż, niezbyt wysoka, średnio trwała, zostawia ślad na szkle.<br>Nos: z butelki zniewalający aromat orzechowy plus słodkie dodatki, daje efekt chałwy orzechowo-waniliowej, spod tego nieśmiało kawa z mlekiem, czekolada deserowa. Silny zdecydowany aromat. Ze szkła bardziej zrównoważony, ale nadal intensywny: nadal chałwa, ale bardziej wyczuwalne palone słody. Alkoholu absolutnie nie czuć.<br>Smak: kremowe, gęste w ustach, wysycenie bardzo niskie. Smak złożony. Dużo słodyczy, znów chałwa waniliowo-orzechowa, do tego likier kawowo-czekoladowo-nugatowy, na finiszu nieśmiało palone nuty, a z każdym łykiem o sobie daje znać przyprawowość od gałki muszkatołowej. Słodkie nuty dominują zdecydowanie, ale nie dają efektu ulepku. Pijąc trunek nadal jest się ?porażanym? silnym aromatem, przez co nawet jest pewien kłopot z oceną samego smaku. Alkohol nieobecny w jakiejkolwiek postaci, nawet nie grzeje w przełyk. Trochę brakuje goryczki (palonej i chmielowej), choć po przełknięciu trunku na języku zostaje kakao i narastająca gałka muszkatołowa. Piwo prawie idealne<div style='text-align:right;'><img src='pliki/oceny.png' alt='oceny' style='vertic"
